<?xml version="1.0"?>
<!DOCTYPE students SYSTEM "ExternalDTD.dtd" [
     <!ENTITY a "hello">
    <!ENTITY b "world">
]>
<students>
    
    <Student>
        <name>&a;</name>
        <age>23</age>
    </Student>

    <Student id="ABC">
        <name>&b;</name>
        <age>23</age>
    </Student>

    
    <Student>
        <name>Student3</name>
        <age>23</age>
    </Student>



</students>
